{
  "$schema": "https://json-schema.org/draft/2020-12/schema",
  "$id": "https://raw.githubusercontent.com/getsentry/MobileBuildMCP/main/schemas/structured-output/mobilebuildmcp.output.debug-stack-result/2.schema.json",
  "type": "object",
  "additionalProperties": false,
  "allOf": [
    {
      "$ref": "https://raw.githubusercontent.com/getsentry/MobileBuildMCP/main/schemas/structured-output/_defs/common.schema.json#/$defs/errorConsistency"
    }
  ],
  "properties": {
    "schema": {
      "const": "mobilebuildmcp.output.debug-stack-result"
    },
    "schemaVersion": {
      "const": "2"
    },
    "didError": {
      "type": "boolean"
    },
    "error": {
      "type": [
        "string",
        "null"
      ]
    },
    "data": {
      "anyOf": [
        {
          "type": "object",
          "additionalProperties": false,
          "properties": {
            "threads": {
              "type": "array",
              "items": {
                "type": "object",
                "additionalProperties": false,
                "properties": {
                  "threadId": {
                    "type": "integer",
                    "minimum": 1
                  },
                  "name": {
                    "type": "string"
                  },
                  "truncated": {
                    "type": "boolean"
                  },
                  "frames": {
                    "type": "array",
                    "items": {
                      "type": "object",
                      "additionalProperties": false,
                      "properties": {
                        "index": {
                          "type": "integer",
                          "minimum": 0
                        },
                        "symbol": {
                          "type": "string"
                        },
                        "displayLocation": {
                          "type": "string"
                        }
                      },
                      "required": [
                        "index",
                        "symbol",
                        "displayLocation"
                      ]
                    }
                  }
                },
                "required": [
                  "threadId",
                  "name",
                  "truncated",
                  "frames"
                ]
              }
            }
          },
          "required": [
            "threads"
          ]
        },
        {
          "type": "object",
          "additionalProperties": false,
          "properties": {
            "diagnostics": {
              "$ref": "https://raw.githubusercontent.com/getsentry/MobileBuildMCP/main/schemas/structured-output/_defs/common.schema.json#/$defs/basicDiagnostics"
            }
          },
          "required": [
            "diagnostics"
          ]
        },
        {
          "type": "null"
        }
      ]
    },
    "nextSteps": {
      "$ref": "https://raw.githubusercontent.com/getsentry/MobileBuildMCP/main/schemas/structured-output/_defs/common.schema.json#/$defs/nextSteps"
    }
  },
  "required": [
    "schema",
    "schemaVersion",
    "didError",
    "error",
    "data"
  ]
}
